{
  "requirement_hash": "a3c0ffee1234",
  "task": "A-3 쿠폰 적용 주문 로직 단위 테스트 생성",
  "target_stack": {
    "language": "TypeScript",
    "unit_test": "Vitest",
    "bdd": "Cucumber.js"
  },
  "requirements": [
    {"id": "REQ-A3-DISCOUNT", "text": "정률·정액 쿠폰의 할인 금액을 계산하고 할인액은 상품 금액보다 커질 수 없다.", "risk": "high"},
    {"id": "REQ-A3-CAP", "text": "maximum_discount가 숫자이면 0을 포함해 계산된 할인을 해당 한도로 제한한다.", "risk": "high"},
    {"id": "REQ-A3-INPUT", "text": "쿠폰 코드가 비었거나 사용자가 로그인하지 않았으면 DB를 조회하지 않고 각각 400과 401로 거절한다.", "risk": "medium"},
    {"id": "REQ-A3-LOOKUP", "text": "존재하지 않거나 만료된 쿠폰은 결제에 적용할 수 없다.", "risk": "medium"},
    {"id": "REQ-A3-MINIMUM", "text": "주문 금액이 최소 주문금액과 같으면 허용하고 1원이라도 부족하면 거절한다.", "risk": "high"},
    {"id": "REQ-A3-USAGE", "text": "사용자의 쿠폰 사용 횟수가 user_usage_limit에 도달하면 거절한다.", "risk": "medium"},
    {"id": "REQ-A3-MOCK", "text": "Supabase 같은 외부 I/O만 Mock하고 calculateCouponDiscount 같은 핵심 도메인 계산은 실제로 실행한다.", "risk": "high"}
  ],
  "source_files": [
    "task-a3-unit-tests/real/lib/coupons.ts",
    "task-a3-unit-tests/src/domain/coupon.ts",
    "task-a3-unit-tests/src/services/createCouponOrder.ts"
  ],
  "constraints": [
    "기존 수기 테스트 파일은 Gen과 Eval에 제공하지 않는다.",
    "각 테스트는 독립된 상태를 사용한다.",
    "단위 테스트와 Gherkin 시나리오를 모두 생성한다."
  ],
  "created_at": "2026-08-17T00:00:00+09:00"
}
